{
  "protocol": "vino.control/1",
  "messageId": "2E7D5995-4A25-4DF2-8207-F6D04D74E07A",
  "correlationId": null,
  "kind": "hello",
  "action": "device.hello",
  "timestamp": "2026-03-24T09:30:00Z",
  "source": {
    "role": "iphone",
    "deviceId": "iphone-001",
    "name": "vino-iphone-a"
  },
  "target": null,
  "context": null,
  "payload": {
    "platform": "iOS",
    "version": "0.1.0",
    "capabilities": {
      "supportsProRes": true,
      "supportsSmoothAutoFocus": true,
      "supportedLenses": ["wide", "ultraWide", "telephoto"]
    }
  }
}

